{
  "task_id": "runtime-module",
  "current_state": "DONE",
  "previous_state": "AUDIT_REVIEW",
  "owner": "orchestrator-agent",
  "approved_artifacts": {
    "spec": true,
    "prototype": true,
    "api_contract": true,
    "rules": true,
    "tests": true,
    "build": true,
    "verification": true,
    "audit": true
  },
  "blocked_by": [],
  "active_agents": [],
  "allowed_write_paths": [],
  "risks": [],
  "updated_at": "2026-03-24T14:54:42.744Z"
}
