{
  "task_id": "whisper-cli-ai-workflow",
  "current_state": "INTAKE",
  "previous_state": null,
  "owner": "spec-agent",
  "approved_artifacts": {
    "spec": false,
    "prototype": false,
    "api_contract": false,
    "rules": false,
    "tests": false,
    "build": false,
    "verification": false,
    "audit": false
  },
  "blocked_by": [],
  "active_agents": [
    "spec-agent"
  ],
  "allowed_write_paths": [
    "00-intake/",
    "01-spec/"
  ],
  "risks": [],
  "updated_at": "2026-03-24T10:30:00+08:00"
}
